{
  "schema": "website-design-compiler/storybook-visual-review/v1",
  "sourceFilesSha256": "8a9ceab3107b178155969b2c71bacc23022197966b6bae5d53723ec9b7e93d4d",
  "reviewer": {
    "kind": "agent",
    "identity": "Codex runtime visual review 2026-08-18"
  },
  "screenshots": [
    {
      "name": "storybook-desktop--governed-sections-section--bento-grid.png",
      "sha256": "932a52dc92140c1c68bbf9739553b67b356e2e8d36b57818b35e8517a8d2fe40",
      "verdict": "PASS",
      "observations": [
        "Desktop: asymmetric four-card hierarchy remains legible; desktop composition uses the available width without overlap or clipping."
      ]
    },
    {
      "name": "storybook-desktop--governed-sections-section--comparison.png",
      "sha256": "1fa58b13eb5b6356577c369b73be21e5ef9fda76aa84301b462b85f43530f12b",
      "verdict": "PASS",
      "observations": [
        "Desktop: comparison headers and evidence rows remain aligned and readable; desktop composition uses the available width without overlap or clipping."
      ]
    },
    {
      "name": "storybook-desktop--governed-sections-section--cta.png",
      "sha256": "cb82ef55d257b1c51e4049aeebeac683a5c89d3d09c92e69af2454cdda6a7790",
      "verdict": "PASS",
      "observations": [
        "Desktop: dark call-to-action surface preserves heading, body, and action contrast; desktop composition uses the available width without overlap or clipping."
      ]
    },
    {
      "name": "storybook-desktop--governed-sections-section--editorial-media.png",
      "sha256": "f0753e27ec05142f100b9ea7e6fb28f8929f2714fb6b64079044e2fd4ffc889d",
      "verdict": "PASS",
      "observations": [
        "Desktop: approved-media identity stays paired with its caption; desktop composition uses the available width without overlap or clipping."
      ]
    },
    {
      "name": "storybook-desktop--governed-sections-section--editorial-prose.png",
      "sha256": "4f34830dd68dc426c1e72e1e7605ac830924f047dba6c448fa8c519a020612ee",
      "verdict": "PASS",
      "observations": [
        "Desktop: display and editorial type hierarchy remains readable; desktop composition uses the available width without overlap or clipping."
      ]
    },
    {
      "name": "storybook-desktop--governed-sections-section--faq.png",
      "sha256": "9e8bddad4a562ec494ba454914e49547bb803dc7cd7c62a7bb6a62c5a083dcd8",
      "verdict": "PASS",
      "observations": [
        "Desktop: accordion disclosure states and answer hierarchy remain clear; desktop composition uses the available width without overlap or clipping."
      ]
    },
    {
      "name": "storybook-desktop--governed-sections-section--feature-grid.png",
      "sha256": "b970307e93b3986df296208e65ba18a57bd841995416f0cbfd46026d29860acc",
      "verdict": "PASS",
      "observations": [
        "Desktop: three governed feature owners remain visually distinct; desktop composition uses the available width without overlap or clipping."
      ]
    },
    {
      "name": "storybook-desktop--governed-sections-section--footer.png",
      "sha256": "9ccaa61e4644dbb40be16c3c5be76af7fc6fb7bc789952e86728d47d78e802f1",
      "verdict": "PASS",
      "observations": [
        "Desktop: brand, policy links, and rights note remain ordered; desktop composition uses the available width without overlap or clipping."
      ]
    },
    {
      "name": "storybook-desktop--governed-sections-section--graphics-2-d-stage.png",
      "sha256": "25f20f8dc7a2aa44994592c503531be58b316b10ab5d89c5b2dcae9c538b66d4",
      "verdict": "PASS",
      "observations": [
        "Desktop: bounded 2D scene stays separated from its semantic explanation; desktop composition uses the available width without overlap or clipping."
      ]
    },
    {
      "name": "storybook-desktop--governed-sections-section--graphics-3-d-stage.png",
      "sha256": "b0420eb4c118b62c76c7ff8d8bccb2302b4dc94a1e6d598ed0a8992ca4c21713",
      "verdict": "PASS",
      "observations": [
        "Desktop: spatial preview stays separated from its fallback explanation; desktop composition uses the available width without overlap or clipping."
      ]
    },
    {
      "name": "storybook-desktop--governed-sections-section--hero.png",
      "sha256": "7a6fd6867ea3ad8be8d7a810c4295bd99834e1e070cb3f68928a5b70a84ee4dd",
      "verdict": "PASS",
      "observations": [
        "Desktop: headline, supporting copy, actions, and approved-media identity remain coherent; desktop composition uses the available width without overlap or clipping."
      ]
    },
    {
      "name": "storybook-desktop--governed-sections-section--media-stage.png",
      "sha256": "eaf17a620b871cce2b0f833aaf0ad2318790963e6a8c4b9d7fdf97fc0a6d24be",
      "verdict": "PASS",
      "observations": [
        "Desktop: asset identity remains visible and the fallback explanation is separated with compliant dark-surface contrast; desktop composition uses the available width without overlap or clipping."
      ]
    },
    {
      "name": "storybook-desktop--governed-sections-section--metrics.png",
      "sha256": "db5a74a7be3d1a98cffc00c9f6e52b04a18904dc9980793d59952c78100b6126",
      "verdict": "PASS",
      "observations": [
        "Desktop: metric values and labels retain strong hierarchy; desktop composition uses the available width without overlap or clipping."
      ]
    },
    {
      "name": "storybook-desktop--governed-sections-section--navigation.png",
      "sha256": "d83872cb7adab38284fd07a8a665e75e6057a1c9d39f28b5fc402257adbd813c",
      "verdict": "PASS",
      "observations": [
        "Desktop: brand and primary action remain visible without clipping; desktop composition uses the available width without overlap or clipping."
      ]
    },
    {
      "name": "storybook-desktop--governed-sections-section--pricing.png",
      "sha256": "cd9a543ee664d6a6d536c15eece82756d13c4a2b1ea9bb9912bba83b9f6e68ab",
      "verdict": "PASS",
      "observations": [
        "Desktop: three evidence-gated tiers remain readable and equally structured; desktop composition uses the available width without overlap or clipping."
      ]
    },
    {
      "name": "storybook-desktop--governed-sections-section--product-showcase.png",
      "sha256": "c64618a36b56c626eb8493e686aa55922d69bfc80fe61fe9f9cf4ae03096d091",
      "verdict": "PASS",
      "observations": [
        "Desktop: approved-media identity and product copy remain distinct typed regions; desktop composition uses the available width without overlap or clipping."
      ]
    },
    {
      "name": "storybook-desktop--governed-sections-section--proof-cloud.png",
      "sha256": "ffedba58630365277ebf8bebb7c2d8d593e0bb127ccd9e59a7e494a3aa4e0dd4",
      "verdict": "PASS",
      "observations": [
        "Desktop: all four evidence items remain readable and visibly grouped; desktop composition uses the available width without overlap or clipping."
      ]
    },
    {
      "name": "storybook-desktop--governed-sections-section--testimonial.png",
      "sha256": "218079f4b797b3012de6a1b9fffbfcd462180d0539b45e634aa60c4f24a0010b",
      "verdict": "PASS",
      "observations": [
        "Desktop: quotation and attributed source retain clear hierarchy; desktop composition uses the available width without overlap or clipping."
      ]
    },
    {
      "name": "storybook-desktop--governed-ui-button--disabled.png",
      "sha256": "23fbce5da49d25b408f058574662b4d38af4d2f32d7fd454aca22bba0a7c8f07",
      "verdict": "PASS",
      "observations": [
        "Desktop: disabled button label, border/fill state, and focus or disabled affordance remain legible without clipping."
      ]
    },
    {
      "name": "storybook-desktop--governed-ui-button--primary.png",
      "sha256": "b7241b392dd371b48083ccd851edf6df6992593cf21243e62b26b0a9f17ed37c",
      "verdict": "PASS",
      "observations": [
        "Desktop: primary button label, border/fill state, and focus or disabled affordance remain legible without clipping."
      ]
    },
    {
      "name": "storybook-desktop--governed-ui-button--secondary.png",
      "sha256": "f2b2b85fb43c96ae4148e7fd160ca50af9f27713c678a15cb43d29d887f05c98",
      "verdict": "PASS",
      "observations": [
        "Desktop: secondary button label, border/fill state, and focus or disabled affordance remain legible without clipping."
      ]
    },
    {
      "name": "storybook-desktop--governed-ui-statuspanel--empty.png",
      "sha256": "3e5d596709903ba294c58504244183315621a47358556fcf112e4f27779334b7",
      "verdict": "PASS",
      "observations": [
        "Desktop: empty status panel keeps its title, message, border, and surface readable without clipping."
      ]
    },
    {
      "name": "storybook-desktop--governed-ui-statuspanel--error.png",
      "sha256": "8a268ca1ac19b288d3f967476b91dd7be1f323252a0c357f43b6f4cad90b3d83",
      "verdict": "PASS",
      "observations": [
        "Desktop: error status panel keeps its title, message, border, and surface readable without clipping."
      ]
    },
    {
      "name": "storybook-desktop--governed-ui-statuspanel--loading.png",
      "sha256": "ce3c7e2aac793db58ba916a79ae60558a854a1836968bda7fe461289f7188c19",
      "verdict": "PASS",
      "observations": [
        "Desktop: loading status panel keeps its title, message, border, and surface readable without clipping."
      ]
    },
    {
      "name": "storybook-desktop--governed-ui-statuspanel--success.png",
      "sha256": "0e3b863e4ec1a0fc623148367174d84ad8015a98f27ce404cf73d9510c017b84",
      "verdict": "PASS",
      "observations": [
        "Desktop: success status panel keeps its title, message, border, and surface readable without clipping."
      ]
    },
    {
      "name": "storybook-mobile--governed-sections-section--bento-grid.png",
      "sha256": "f8cafaeaaec4479b34b438e89aa46dd4cb11596d3fbbdffa2831590e2b9a2873",
      "verdict": "PASS",
      "observations": [